{
  "schema_version": "sas-harness-outcome-registry/v1",
  "repository": "EndeavorEverlasting/SysAdminSuite",
  "policy": {
    "requested_goal_required": true,
    "validation_is_admission_not_completion": true,
    "dry_run_must_emit_artifact": true,
    "same_turn_continuation_required": "When the requested goal remains unproven and the next registered command is safe, authorized, and dependency-satisfied, execute it in the same agent turn instead of handing the command back to the operator.",
    "allowed_terminal_outcomes": ["artifact_created","build_artifact_created","runtime_started","product_deployed","runtime_proven","blocked_with_actionable_gate"],
    "forbidden_terminal_outcomes": ["tests_passed_only","status_reported_only","command_printed_only","wait_for_next_chat","operator_repeats_agent_work"]
  },
  "contracts": [
    {"command_id":"android-toolchain","success_outcome":"artifact_created","success_artifact_id":"android-toolchain-result","terminal_goals":["inventory","plan","diagnose","artifact","verified-toolchain"],"continuations":[],"failure_outcome":"blocked_with_actionable_gate"},
    {"command_id":"android-toolchain-adminbox","success_outcome":"artifact_created","success_artifact_id":"android-toolchain-result","terminal_goals":["inventory","plan","diagnose","artifact","verified-toolchain"],"continuations":[],"failure_outcome":"blocked_with_actionable_gate"},
    {"command_id":"android-provider","success_outcome":"artifact_created","success_artifact_id":"android-provider-receipt","terminal_goals":["artifact","diagnose","readiness","inventory","probe","tcpip-cert"],"continuations":[],"failure_outcome":"blocked_with_actionable_gate"},
    {"command_id":"hh-cc-reader-rea-artifact","success_outcome":"artifact_created","success_artifact_id":"hh-cc-reader-rea-receipt","terminal_goals":["artifact","analyze-artifact","diagnose-artifact"],"continuations":[],"failure_outcome":"blocked_with_actionable_gate"},
        {"command_id":"harness-validate","success_outcome":"artifact_created","success_artifact_id":"harness-registry-validation-result","terminal_goals":["validate","artifact"],"continuations":[],"failure_outcome":"blocked_with_actionable_gate"},
    {"command_id":"harness-outcome-validate","success_outcome":"artifact_created","success_artifact_id":"harness-outcome-validation-result","terminal_goals":["validate","artifact"],"continuations":[],"failure_outcome":"blocked_with_actionable_gate"},
    {"command_id":"deployment-state-validate","success_outcome":"artifact_created","success_artifact_id":"deployment-state-validation-result","terminal_goals":["validate","artifact"],"continuations":[],"failure_outcome":"blocked_with_actionable_gate"},
    {"command_id":"autologon-field-completion-contracts","success_outcome":"artifact_created","success_artifact_id":"autologon-field-completion-contract-result","terminal_goals":["validate","artifact"],"continuations":[],"failure_outcome":"blocked_with_actionable_gate"},
    {"command_id":"harness-completeness","success_outcome":"artifact_created","success_artifact_id":"harness-completeness-result","terminal_goals":["validate","artifact"],"continuations":[],"failure_outcome":"blocked_with_actionable_gate"},
    {"command_id":"one-command-harness-proof","success_outcome":"artifact_created","success_artifact_id":"local-harness-proof","terminal_goals":["validate","artifact","synthetic-harness-proof"],"continuations":[],"failure_outcome":"blocked_with_actionable_gate"},
    {"command_id":"offline-floor","success_outcome":"artifact_created","success_artifact_id":"offline-survey-floor-result","terminal_goals":["validate","artifact"],"continuations":[],"failure_outcome":"blocked_with_actionable_gate"},
    {"command_id":"powershell-tests","success_outcome":"artifact_created","success_artifact_id":"pester-suite-result","terminal_goals":["validate","artifact"],"continuations":[],"failure_outcome":"blocked_with_actionable_gate"},
    {"command_id":"managed-tests","success_outcome":"artifact_created","success_artifact_id":"managed-tests-result","terminal_goals":["validate","artifact"],"continuations":[],"failure_outcome":"blocked_with_actionable_gate"},
    {"command_id":"dashboard-build","success_outcome":"build_artifact_created","success_artifact_id":"dashboard-publish-output","terminal_goals":["build","artifact"],"continuations":[{"when_goal":"run","command_id":"dashboard-launch","same_turn":true,"requires_authorization":false,"dependency":"dashboard publish output exists"}],"failure_outcome":"blocked_with_actionable_gate"},
    {"command_id":"dashboard-launch","success_outcome":"runtime_started","success_artifact_id":null,"terminal_goals":["run"],"continuations":[],"failure_outcome":"blocked_with_actionable_gate"},
    {"command_id":"operator-context","success_outcome":"artifact_created","success_artifact_id":"operator-session-state","terminal_goals":["context","diagnose","next-action"],"continuations":[],"failure_outcome":"blocked_with_actionable_gate"},
    {"command_id":"operator-next","success_outcome":"artifact_created","success_artifact_id":"operator-session-state","terminal_goals":["next-action"],"continuations":[],"failure_outcome":"blocked_with_actionable_gate"},
    {"command_id":"operator-evidence-recovery","success_outcome":"artifact_created","success_artifact_id":"operator-evidence-recovery-index","terminal_goals":["recover-evidence","artifact","diagnose"],"continuations":[],"failure_outcome":"blocked_with_actionable_gate"},
    {"command_id":"hh-cc-reader-probe","success_outcome":"artifact_created","success_artifact_id":"hh-cc-reader-probe-result","terminal_goals":["probe","diagnose","readiness","artifact"],"continuations":[],"failure_outcome":"blocked_with_actionable_gate"},
    {"command_id":"hh-cc-reader-endpoint-probe","success_outcome":"artifact_created","success_artifact_id":"hh-cc-reader-endpoint-probe-result","terminal_goals":["probe","diagnose","endpoint-correlation","artifact"],"continuations":[],"failure_outcome":"blocked_with_actionable_gate"},
    {"command_id":"hh-cc-reader-network-switch-prepare","success_outcome":"artifact_created","success_artifact_id":"hh-cc-reader-network-checkpoint-result","terminal_goals":["prepare","checkpoint","artifact"],"continuations":[],"failure_outcome":"blocked_with_actionable_gate"},
    {"command_id":"hh-cc-reader-network-checkpoint","success_outcome":"artifact_created","success_artifact_id":"hh-cc-reader-network-checkpoint-result","terminal_goals":["checkpoint","diagnose","artifact"],"continuations":[],"failure_outcome":"blocked_with_actionable_gate"},
    {"command_id":"hh-cc-reader-home-lab-discovery","success_outcome":"artifact_created","success_artifact_id":"hh-cc-reader-home-lab-discovery-result","terminal_goals":["discover","probe","diagnose","artifact"],"continuations":[],"failure_outcome":"blocked_with_actionable_gate"},
    {"command_id":"hh-cc-reader-alpha-input-plan","success_outcome":"artifact_created","success_artifact_id":"hh-cc-reader-alpha-input-plan-result","terminal_goals":["guide","input-plan","artifact"],"continuations":[],"failure_outcome":"blocked_with_actionable_gate"},
    {"command_id":"hh-cc-reader-estate-authority-evaluate","success_outcome":"artifact_created","success_artifact_id":"hh-cc-reader-estate-authority-result","terminal_goals":["evaluate","proven-path","artifact","readiness"],"continuations":[],"failure_outcome":"blocked_with_actionable_gate"},
{"command_id":"hh-cc-reader-estate-packet-normalize","success_outcome":"artifact_created","success_artifact_id":"hh-cc-reader-estate-packet-normalized","terminal_goals":["normalize","artifact","readiness"],"continuations":[{"when_goal":"proven-path","command_id":"hh-cc-reader-estate-authority-evaluate","same_turn":true,"requires_authorization":false,"dependency":"normalized external P5 packet exists and contains only truthful settled, derivable, or observed inputs"}],"failure_outcome":"blocked_with_actionable_gate"},
    {"command_id":"hh-cc-reader-firmware-roundtrip-evaluate","success_outcome":"artifact_created","success_artifact_id":"hh-cc-reader-firmware-roundtrip-result","terminal_goals":["evaluate","artifact","readiness"],"continuations":[],"failure_outcome":"blocked_with_actionable_gate"},
    {"command_id":"hh-cc-reader-firmware-batch-normalize","success_outcome":"artifact_created","success_artifact_id":"hh-cc-reader-firmware-batch-plan","terminal_goals":["normalize","artifact","readiness"],"continuations":[],"failure_outcome":"blocked_with_actionable_gate"},
    {"command_id":"hh-cc-reader-firmware-event-export","success_outcome":"artifact_created","success_artifact_id":"hh-cc-reader-firmware-event","terminal_goals":["export","artifact","handoff"],"continuations":[],"failure_outcome":"blocked_with_actionable_gate"},
    {"command_id":"hh-cc-reader-paxstore-terminal-observe","success_outcome":"artifact_created","success_artifact_id":"hh-cc-reader-paxstore-terminal-observation","terminal_goals":["observe","artifact","readiness","baseline"],"continuations":[{"when_goal":"baseline","command_id":"hh-cc-reader-firmware-roundtrip-evaluate","same_turn":true,"requires_authorization":false,"dependency":"observation access_state is OBSERVED with identity_bound true and current_firmware_value present"}],"failure_outcome":"blocked_with_actionable_gate"},
    {"command_id":"hh-cc-reader-paxstore-ui-observation-ingest","success_outcome":"artifact_created","success_artifact_id":"hh-cc-reader-paxstore-ui-observation","terminal_goals":["observe","ingest","artifact","readiness","baseline"],"continuations":[{"when_goal":"baseline","command_id":"hh-cc-reader-firmware-roundtrip-evaluate","same_turn":true,"requires_authorization":false,"dependency":"UI observation access_state is OBSERVED with identity_bound true and current_firmware_value present"}],"failure_outcome":"blocked_with_actionable_gate"},